{
  "SourceProjectName": "ArBilling.E2ETests",
  "UiTargets": [
    {
      "SourceExpression": "page.User",
      "TargetExpression": "GetByTestId(\"widget-user\")",
      "TargetKind": "TestId"
    },
    {
      "SourceExpression": "page.Name",
      "TargetExpression": "GetByTestId(\"user-name\")",
      "TargetKind": "TestId"
    },
    {
      "SourceExpression": "page.MenuItems.SideMenuButtonSearch",
      "TargetExpression": "GetByTestId(\"side-menu-search\")",
      "TargetKind": "TestId"
    },
    {
      "SourceExpression": "page.MenuItems.SideMenuCatalogs",
      "TargetExpression": "GetByTestId(\"side-menu-catalogs\")",
      "TargetKind": "TestId"
    },
    {
      "SourceExpression": "page.MenuItems.SideMenuCatalogsPartners",
      "TargetExpression": "GetByTestId(\"side-menu-catalogs-partners\")",
      "TargetKind": "TestId"
    },
    {
      "SourceExpression": "page.WidgetSearch",
      "TargetExpression": "GetByTestId(\"widget-search\")",
      "TargetKind": "TestId"
    },
    {
      "SourceExpression": "page.FuterUser",
      "TargetExpression": "GetByTestId(\"futer-user\")",
      "TargetKind": "TestId"
    }
  ],
  "PageObjects": [
    {
      "SourceType": "WidgetPage",
      "TargetType": "WidgetPage",
      "VariableName": "_page",
      "ConstructorStrategy": "New"
    },
    {
      "SourceType": "RegistryAgentPage",
      "TargetType": "RegistryAgentPage",
      "VariableName": "_page",
      "ConstructorStrategy": "New"
    }
  ],
  "Methods": []
}
